,Level,Type_of_Job,Description
71,Mid-Senior level,Full-time,"Why VacasaWe started with just one home and an idea: to bring homeowners and renters together with smart technology and caring local teams. Today, we’re the largest full-service vacation rental company in the US. Today, we’re one of the fastest-growing vacation rental companies in the world—thanks to the people who give us their best every day. You’ll fit right in here if you’re curious, entrepreneurial, and thrive in a rapid-growth environment.What We’re Looking ForWe are seeking a leader who is passionate about building a world class Data Science team in order to achieve Vacasa’s goal of providing a fantastic home base for any vacation. In addition to solving problems and removing roadblocks for your team, you’ll help define the vision, tools, and processes that help us take on challenges like: Determining the potential rental value of any vacation rental home, and how to increase that potential Pricing each of our unique units in real time given global market conditions to ensure we have homes available for potential guests while maximizing owner revenue Optimally scheduling home cleaning while giving our employees scheduling certainty Matching each guest’s expectations with a tailored experience  What You’ll Do Manage and guide the careers of our growing Data Science team Represent their work to the executive team and the rest of the organization Guide the team’s research, discovery, and implementation Stay curious about the field of Data Science, operate with empathy towards others, drive innovation, and remain accountable to yourself & team Keep your tech skills (Python, R, Stata, Big Data, etc.) sharp by contributing to our code Skills You’ll Need Experience managing folks working on data science projects Inquisitivity about statistics, systems engineering, algorithms, economics, operations research and related fields Advanced proficiency with Git/GitHub, Python, SQL, cloud computing, and machine learning Bonus Points Stellar listening and communication skills A Master’s or PhD with coursework focused on building data models You have intriguing stories to tell about your work applying the right statistical techniques to the right circumstances, have lead folks in applying those techniques for a multitude of situations, and the prospect of more work in this arena genuinely excites you What You’ll Get Health/dental/vision insurance—100% coverage option 401K retirement savings plan with up to a 6% company match Vacation time Paid sick leave and holidays Career advancement opportunities Employee discounts All the equipment you’ll need to be successful Great colleagues and culture"
72,Mid-Senior level,Full-time,"Shipt is a membership-based marketplace that helps people get the things they need. Our friendly shoppers handpick fresh groceries and household essentials and deliver them to members in as soon as one hour.What Does Data Science Do at Shipt?At Shipt, we work at the intersection of a multi-sided marketplace and we’re looking for help understanding data collected across this complex marketplace, optimizing existing processes, and making predictions to help improve the product and experience.Our team tackles a wide variety of projects, ranging from developing sophisticated predictive and machine learning models, conducting ad-hoc research, working with engineers on service development and deployments, and presenting results to functional teams. Our ideal candidate will be data-driven, intellectually curious, and a clear communicator.Your Days Will Look Like… leading and developing a highly skilled team of data scientists and analysts … providing technical guidance and implementation details for the team as they work through projects big and small… collaborating with partners across product, engineering, and operations to accomplish business goals… leading and prioritizing exploratory work to uncover new opportunities… working with leaders to build data-informed strategies and roadmapsYou may be a fit for this role if you:… are a strong data scientist with 4+ years of experience… have 1+ years managing data scientists or 1+ years as a Tech Lead… have expertise solving complex and highly impactful quantitative problems with at least one scripting language (Python or R - we use both) and SQL… enjoy mentoring data scientists through their projects and careers… don’t mind getting hands on with challenging technical problems across a broad spectrum of data science problems, encompassing NLP, search, operations research, and semi-supervised learning problemsYou'll Get Bonus Points For... experience with batch and streaming data frameworks... work around on-demand or multi-sided marketplace problemsHere are some projects that the team is actively working on:Improving search rankings and relevancy through engagement metrics, inferred popularity, named entity recognition, and a number of other techniquesImproved order offering and the logistical component of deliveries through order batchingNLP on free text to pull out specific product information and product matchesWe are an equal opportunity employer and value diversity at our company. We do not discriminate on the basis of race, religion, color, national origin, gender, sexual orientation, age, marital status, veteran status, or disability status.Pursuant to the San Francisco Fair Chance Ordinance, we will consider for employment qualified applicants with arrest and conviction records."
73,Entry level,Full-time,"Qualifications Minimum of MS, Phd Strongly Preffered, in Statistics, or related quantitive discipline Minimum 5 years of experience with phd and 8 Years of experience with MS in relevant areas of Data Science and proven capability in applying Accomplished academic background in health data applications hard evidence of extensive biomedical collaborations and publication record preferred Strong analytical and problem-solving Skills Strong technical Skills Experience in R, python, SQL, Spark, Cloud Services (Azure, AWS) Excellent writing, Communication and Presentation Skills, proficiency in data interpretation, delivering messages with impact to internal and external customers. Intellectual curiosity and agility Ability to work independently as well as collaboratively within a team setting"
74,Entry level,Full-time,"As Ribbon's Data Science Lead, you'll create best practices and grow the data culture. You'll work closely with the leaders across every department to create more teams which are run by data driven insights. You'll have the opportunity to grow and manage the DS function and team.Your Focus Becoming a subject matter expert in sales operations, structured finance and real estate operations. Understand the systems, understand the users, and drive towards identifying core opportunities for the business. Work directly with directors of finance, marketing and sales to create more data driven functions across the business. Prepare technical reports, reviews and analysis of current processes. Participate in backlog grooming, sprint planning, and retrospectives. Responsible for translating high-level business requirements into detailed functional specifications and managing the requests for changes. Establish data driven practices for understanding high level business metrics like CAC and LTV.Your Skills Strong organizational skills, including the ability to successfully manage multiple priorities and projects and consistently meet deadlines in a fast-paced environment. Experience with cloud platforms, ideally AWS. Familiarity with SQL and noSQL datastores like Redshift, Postgres, Elasticsearch and MongoDB. Experience with SQL or other data visualization tools (like R or Python). You have a track record building or scaling data driven organizations."
75,Not Applicable,Full-time,"Minimum Qualifications Bachelor's degree in a quantitative discipline or equivalent practical experience. 4 years of relevant work experience involving quantitative data analysis Experience with statistical software (e.g., R, Python) and database languages (e.g., SQL). Preferred Qualifications Master's degree or higher in a quantitative discipline (e.g., Statistics, Computer Science, Math, Engineering) or equivalent practical experience Strong knowledge and hands-on experience with both supervised and unsupervised learning (e.g. time series forecasting, clustering, classificaiton) and/or Big Data techniques (Spark, Pig, Hive) is a big plus. Demonstrable track record of dealing well with ambiguity, prioritizing needs, and delivering results in a dynamic environment Effective communication (written and verbal) to translate technical solutions and methodologies to senior leadership About The JobAt Google, data drives all of our decision making. The Finance Business Intelligence and Analytics team combines business acumen, technology and innovation to organize data, enable insights and create a data driven and efficient Finance organization. You will have a unique opportunity to gain perspectives on Google’s core businesses, services and the ecosystems that they operate within.As a Data Science Specialist, you will work on strategic business challenges across multiple business areas (ex. Ads, YouTube, Search, Play, etc.) through the lens of monetization. You will collaborate with data engineers, analysts and PMs to create an end-to-end data solutions to enable our finance partners to make informed decisions, manage risks and opportunities. You will demonstrate statistical and machine learning experience and an understanding of our business models to tackle complex data problems.The name Google came from ""googol,"" a mathematical term for the number 1 followed by 100 zeros. And nobody at Google loves big numbers like the Finance team when providing in depth analysis on all manner of strategic decisions across Google products. From developing forward-thinking analysis to generating management reports to scaling our automated financial processes, the Finance organization is an important partner and advisor to the business.Responsibilities Partner with Finance leadership and their teams to understand business context and identify science solutions. Apply statistical and machine learning methods to solve large scale problems, including the full modeling lifecycle (e.g. data manipulation, building and evaluating models, interpreting results, transitioning solutions to production, performance monitoring, recalibrating models, etc.) Create data visualization to summarize the modeling insights and communicate them to internal team members and business stakeholders Continue to widen and deepen data science and engineering skill sets Coach junior members and share knowledge with the broader team At Google, we don’t just accept difference—we celebrate it, we support it, and we thrive on it for the benefit of our employees, our products and our community. Google is proud to be an equal opportunity workplace and is an affirmative action employer. We are committed to equal employment opportunity regardless of race, color, ancestry, religion, sex, national origin, sexual orientation, age, citizenship, marital status, disability, gender identity or Veteran status. We also consider qualified applicants regardless of criminal histories, consistent with legal requirements. See also Google's EEO Policy and EEO is the Law. If you have a disability or special need that requires accommodation, please let us know by completing this form ."
76,Mid-Senior level,Full-time,"Lead Data Engineer     Data Engineer required for a Tech Innovation Start Up based in Manhattan working in an $80 Billion market. This company leverages human biometrics and innovative technology to personalize a product that enhances humans day to day life! Their overall goal is increase people’s energy and happiness levels with this innovative technology. It has been named one of the most innovative firms over the last 2 years.   As a Data Engineer, you will be required to work with massive volumes of data to build their ML driven data pipeline. The Data Engineer will need multiple programming languages whilst working on the full stack to add value to the ecosystem of data. To maximise the performance of the product, the data engineer must also be able to apply machine learning techniques and algorithms to the applications.   Key responsibilities: Optimizing platforms for Data Science research by using software engineering best practices. Implementation of ML algorithms by writing data applications. The use of multiple programming languages on a daily bases across a full stack. Interface with data scientists, engineers, product managers, and business development teams to understand data needs. Building a data pipeline that incorporates stats and statistical algorithms.   Summary of skills: 2+ years of professional coding experience with C# or Java You have experience dealing with data at scale, processing and transforming hundreds of millions of data points per day. You have first-rate SQL skills, but you are aware of its limits. You know when to use it, and when it’s better to find a different solution. You are familiar with ETL tools and problems. We use Airflow, Redshift, Glue, and many other systems. You have the ability to work in a backend environment with a formal education in Computer Science or similar subject. Although it’s not essential we would favor a M.Sc. (Masters). An understanding of machine learning algorithms to be able to work closely with Data Scientist in building ML Models. A knowledge of AWS or Docker or Kubernetes is preferred (Would also consider GCP)   The manager is looking to interview a suitable Data Engineer as soon as Friday 16th, August. The positon should begin at the start of September."
77,Mid-Senior level,Full-time,"Senior Deep Learning Scientist   Location: New York, NY    A high growth startup is looking to hire elite Deep Learning Scientists.  If you have a passion for developing next generation algorithms and a desire to help change the way we live and work then look no further.   We are designing and training various deep learning models to help people for precision medicine and therapeutics.   Solve incredibly challenging problems with extremely passionate and experienced data scientists.  We are looking to hire experienced teammates who are equally passionate about problem solving.   Skills:  Ph.D or MS in Computer Science, Physics, Electrical Engineering, Computer Vision, Statistics or Math  Strong machine learning or NLP, BERT Experience working with deep learning frameworks like TensorFlow, Caffe2, Theano, CNTK and PyTorch Strong understanding of deep learning theory: CNN, RNN, LSTM and ANN Solid programming Python  Graphics GPU computing CUDA, OpenCL   Level: Senior or Lead (we are unable to sponsor at this time)  Full health benefits  Unlimited vacation Unlimited sick days Commuter benefits and more...     Please reach out for more information key words: image processing, machine processing, deep learning, neural networks, python"
78,Not Applicable,Full-time,"We are looking for a Data Scientist with experience applying Data Science processes and tools to solve real-world problems for our customers in the Federal, Defense, and Intelligence sectors. ResponsibilitiesWork with stakeholders throughout the organization to identify opportunities for leveraging Publicly Available Information (PAI) as well as Federal, Defense, and Intelligence data.Assess the effectiveness and accuracy of new data sources and data gathering techniques.Develop custom data models and algorithms.Coordinate with different functional teams to implement models and monitor outcomes.Develop processes and tools to monitor and analyze model performance and data accuracy.QualificationsStrong problem solving skills with an emphasis on product development.Experience using statistical computer languages (R, Python, SQL, etc.) to manipulate data and draw insights from large data sets.Experience working with and creating data architectures.Knowledge of a variety of machine learning techniques (clustering, decision tree learning, artificial neural networks, etc.) and their real-world advantages/drawbacks.Knowledge of advanced statistical techniques and concepts (regression, properties of distributions, statistical tests and proper usage, etc.) and experience with applications.Excellent written and verbal communication skills for coordinating across teams.A drive to learn and master new technologies and techniques.Minimum RequirementsUS CitizenshipMust qualify for a security clearance from the U.S. Department of Defense. Take the quiz available here: https://bit.ly/2NMh1Pj.B.S. in a field of Science, Technology, Engineering, or MathematicsPreferencesActive clearance with the Department of DefenseM.S. or Ph.D. in a field of Science, Technology, Engineering, or Mathematics10+ years of work experienceExperience with DoD/IC Information SystemsExperience with Big Data software projects (e.g. Hadoop, Spark, Kafka, Elasticsearch)Raptics, Inc. is an equal opportunity employer. We celebrate diversity and are committed to creating an inclusive environment for all employees."
79,Not Applicable,Contract,"•	Big data full stack engineers  – who are conversant with Apache Spark, Scala, Kafka & HBase.•	Emphasis on search capability / search optimization •	Experience working in an Agile environment o	3rd party – Streamset & Naveda o	SQL Server •	Web Services – Spring Boot •	DevOps – Chef 11/12, Dockers•	Data gather & pusher – Caska •	Working w/Data Science Group – Modeling & Scoring "
80,Mid-Senior level,Full-time,"Job descriptionPosition SummaryThis individual will be responsible for developing and managing the data architecture to support credit limits data mart and marketing analytics and reporting. This individual will partner with technology and individuals across the Customer Insight organization to define, design, and build scalable solutions and processes to support key marketing analytics initiatives.Key ResponsibilitiesResponsible for architecting, developing, managing, and automating data solutions to support advanced reporting and analytic solutions for Credit Limit,Overdraft Limit, and marketingSupport the data needs for key marketing analytics initiatives. Examples may include multi-touch attribution, media mix modeling, net promoter score, customer segmentation, and propensity modelingMaintain data controls and quality control programs across marketing data sourcesWork with team members to design and create standardized SAS programs and data to more efficiently support reporting metricsSupport ad-hoc data analysis requests from senior leadershipParticipate in technical design reviews and provide technical expertiseQualificationsRequired Qualifications: 3+ years of experience with SAS or SQL to access, transform, and report on data is required. The individual is expected to be ""hands-on"" with the dataBachelors' Degree in computer science or related business, engineering or quantitative field (e.g. CS, MIS, Statistics, Mathematics, Engineering, etc.)Desired QualificationsProficiency with SAS required (EG a strong plus), intermediate to expert SQL skills and experience with large data warehousing environments (Teradata, Hadoop, Oracle, etc.)Experience with Tableau or other BI/visualization toolExposure to UNIX programmingMarketing analytics and operations including database marketing, direct marketing measurement, response attribution or campaign related dataKnowledge of the financial services industrySAS Data Integration Developer will be responsible for maintaining, manipulating and managing the data to feed into the Analytical Data Marts. 3+ years of experience in advanced SAS programming. Experience with SQL and relational database is required.Must have very good SAS Application Development Programming experienceDevelopment experience in SAS, SQL, UNIXExperience in SAS/MACROS SAS/SQL is a mustExperience working with databases like MySQL/TERADATADatabase ETL experience"
81,Associate,Contract,"Job DescriptionSenior Java DeveloperDenver, COContract OpportunityWe're in search of a seasoned developer who loves building great experiences and has a passion for making complex operations easy to perform. You will be modifying existing applications and data access logic to meet more complex requirements.Technical Experience Degree in Computer Science/Engineering or related discipline Minimum 3 years of experience designing and developing in Java Very skilled programming with React Very skilled programming with SpringBoot Experience in Agile software development methodologies We're explicitly looking for React experience in a Java environment"
82,Executive,Full-time,"SVP Data Science & AnalyticsHouston, TX  The SVP of Data Science & Analytics will report to the CIO and be responsible for building and managing a team of data engineers and data scientists to develop, implement, and maintain the organisations data analytics program. The successful candidate will ensure our organisations capability to model, predict, and improve decision making and operational performance across all levels.   Key requirements: • Developing and managinh the entire organizaitions data analytics strategy including articulating to all members in c-suite a strong vision for the creative use of data and analytics to transform the industry   • Develops and maintainng relationships across the organization to align data strategy and identify opportunities for using best in class models and algorithms to enhance efficiency and improve current business practices    • Implements the use of regression and machine learning techniques to predict operational issues and opportunities   • Integrates and mines large data sets, connecting data from various sources to define insights and patterns using predictive and prescriptive analytics.  Essential experience and job requirements:  • Experience with regression analysis, including GLMs, Bayesian methods, and classification techniques.   • Experience with numerical optimization including LP, NLP, iterative and/or stochastic methods    • Demonstrated proven track record of successfully leading multi-discipline teams .    • Demonstrated ability to build productive relationships with employees at all levels of the organization."
83,Associate,Full-time,"Data Scientist is needed in Culver City, CA for 3-6 months (that will convert to a FULL TIME position)   Our client is looking for a Data Scientist with strong business acumen to join their rapidly growing data team. You will have high visibility in this role within the company partnering with media, business development, and strategy teams.   This role requires someone to work with large volumes of social engagement and transaction data to discover trends, analyze results, patterns, and provide ad-hoc exploration to make ambiguous data actionable.   Specific Requirements include:   Provide Thought leadership in customer      segmentation, behavior based modeling (propensity, churn, LTV) data      strategy and analytic approaches  Work with clients to better understand      strategic business decisions.  Develop optimization plans for ongoing      marketing campaigns.  Integrate and improve machine learning      pipelines on propensity scoring and LTV projection to granularize the      understanding of user journey and customer value.  Drive buildout and improvement of ETL      pipelines in support of data aggregation movement and analysis.    We are seeking Data Scientists who meet the following requirements:   6+ Years experience data mining very large      complex multi-dimensional datasets.  Must have technical mastery with large      individual behavioral data sets (gaming, retail, financial services) and      expertise in communication channel best practices.  Must have Technical mastery in database      mining tools and be a SQL and Excel Master.  Must be proficient in SAS/ R/ Python (any of      the 3) and be able to coach and train others on best practices. (ideally)  Must be an Excel master able to write      Macros.  Prefer candidates who a degree in data      science or a quantitative field.  Must have experience work Marketing      Measurement methodologies.    This is a technical Data Science role more related to manipulating and analyzing data to derive insights than being able to translate insights into actionable business decisions.    Must be at least 18 years old. Onward Search is a drug-free workplace. Onward Search is an equal opportunity employer, dedicated to a policy of non-discrimination in employment with regard to race, color, religion, gender, sexual orientation, national origin, age, disability, genetic information, veteran status or any other classification protected by federal, state and local laws and ordinances, nationally and internationally. EOE/M/F/D/V/SO"
