,Level,Type_of_Job,Description
137,Director,Full-time,"Time Saver:  You must have 5+ years of recent strategic consulting experience working for a mid - large size IT consulting firm focused on C suite services to qualify for this role. (Slalom, Deloitte, Accenture are type examples).    Company is a growing high value management consulting firm to 75+ of the the most impactful F500 firms, servicing CIOs and teams from strategy and planning through execution and delivery.  Increasingly, clients they service are seeking to explore and optimize the business by embracing AI, ML and Data Science as a holistic solution. This role will be very client facing, working primarily CIO, CTO and other executive teams supporting enterprise wide initiatives.   As the Director, Data Science, the professional in this role will also be responsible for mentoring Data Engineers, Information Analysts and Information Architects, assisting junior consultants as they learn more about the tools, techniques and business outcomes that data science can enable. The ability to effectively manage talent and create an engaged, high-performing team environment is extremely important to achieving success in this role   The Director, Data Science will be required to reside in one of 6 cities and will travel based on client needs.   Qualified candidates will have:   A degree in computer science, MIS, mathematics or statistics. Strong verbal and written communication skills experienced with business case creation and proofs of concept. 5+ years of F500 C level facing professional services experience. Some experience with oral presentations and competitive positioning.  8+ years of progressive experience in data science methods and analytics consulting, or 15+ years of combined experience in data warehousing, data architecture and information management projects involving analytics. Demonstrated ability to deliver data science solutions for clients (end-to-end design and delivery of significant data science project work). Professional experience applying advanced analytics and data mining techniques to enable decision support systems and customer strategies. Proven data engineering or data visualization experience with large and/or complex data environments. Advanced understanding of machine learning techniques and algorithms, such as k-NN, Naive Bayes, SVM, Decision Forests and Neural Networks. Experience with commonly used data science toolkits, such as Python, SAS, R, Weka, NumPy or MatLab. Experience working with data visualization tools, such as D3.js and GGplot. Proficient skills using query languages, such as MongoDB, Cassandra and HBase. Strong applied statistics skills. High intellectual curiosity with the desire to identify potential use cases for predictive analytics. Experience creating impactful models and algorithms for multiple functional areas (e.g., risk management, customer insights, real-time decision support, etc.). Expert understanding of industry trends for consumer insights analytics. Ability to understand and apply trends in research and analytics, and to apply learning, insights and recommendations to drive critical objectives."
138,Director,Full-time,"Time Saver:  You must have 5+ years of recent strategic consulting experience working for a mid - large size IT consulting firm focused on C suite services to qualify for this role. (Slalom, Deloitte, Accenture are type examples).    Company is a growing high value management consulting firm to 75+ of the the most impactful F500 firms, servicing CIOs and teams from strategy and planning through execution and delivery.  Increasingly, clients they service are seeking to explore and optimize the business by embracing AI, ML and Data Science as a holistic solution. This role will be very client facing, working primarily CIO, CTO and other executive teams supporting enterprise wide initiatives.   As the Director, Data Science, the professional in this role will also be responsible for mentoring Data Engineers, Information Analysts and Information Architects, assisting junior consultants as they learn more about the tools, techniques and business outcomes that data science can enable. The ability to effectively manage talent and create an engaged, high-performing team environment is extremely important to achieving success in this role   The Director, Data Science will be required to reside in one of 6 cities and will travel based on client needs.   Qualified candidates will have:   A degree in computer science, MIS, mathematics or statistics. Strong verbal and written communication skills experienced with business case creation and proofs of concept. 5+ years of F500 C level facing professional services experience. Some experience with oral presentations and competitive positioning.  8+ years of progressive experience in data science methods and analytics consulting, or 15+ years of combined experience in data warehousing, data architecture and information management projects involving analytics. Demonstrated ability to deliver data science solutions for clients (end-to-end design and delivery of significant data science project work). Professional experience applying advanced analytics and data mining techniques to enable decision support systems and customer strategies. Proven data engineering or data visualization experience with large and/or complex data environments. Advanced understanding of machine learning techniques and algorithms, such as k-NN, Naive Bayes, SVM, Decision Forests and Neural Networks. Experience with commonly used data science toolkits, such as Python, SAS, R, Weka, NumPy or MatLab. Experience working with data visualization tools, such as D3.js and GGplot. Proficient skills using query languages, such as MongoDB, Cassandra and HBase. Strong applied statistics skills. High intellectual curiosity with the desire to identify potential use cases for predictive analytics. Experience creating impactful models and algorithms for multiple functional areas (e.g., risk management, customer insights, real-time decision support, etc.). Expert understanding of industry trends for consumer insights analytics. Ability to understand and apply trends in research and analytics, and to apply learning, insights and recommendations to drive critical objectives."
139,Director,Full-time,"Time Saver:  You must have 5+ years of recent strategic consulting experience working for a mid - large size IT consulting firm focused on C suite services to qualify for this role. (Slalom, Deloitte, Accenture are type examples).    Company is a growing high value management consulting firm to 75+ of the the most impactful F500 firms, servicing CIOs and teams from strategy and planning through execution and delivery.  Increasingly, clients they service are seeking to explore and optimize the business by embracing AI, ML and Data Science as a holistic solution. This role will be very client facing, working primarily CIO, CTO and other executive teams supporting enterprise wide initiatives.   As the Director, Data Science, the professional in this role will also be responsible for mentoring Data Engineers, Information Analysts and Information Architects, assisting junior consultants as they learn more about the tools, techniques and business outcomes that data science can enable. The ability to effectively manage talent and create an engaged, high-performing team environment is extremely important to achieving success in this role   The Director, Data Science will be required to reside in one of 6 cities and will travel based on client needs.   Qualified candidates will have:   A degree in computer science, MIS, mathematics or statistics. Strong verbal and written communication skills experienced with business case creation and proofs of concept. 5+ years of F500 C level facing professional services experience. Some experience with oral presentations and competitive positioning.  8+ years of progressive experience in data science methods and analytics consulting, or 15+ years of combined experience in data warehousing, data architecture and information management projects involving analytics. Demonstrated ability to deliver data science solutions for clients (end-to-end design and delivery of significant data science project work). Professional experience applying advanced analytics and data mining techniques to enable decision support systems and customer strategies. Proven data engineering or data visualization experience with large and/or complex data environments. Advanced understanding of machine learning techniques and algorithms, such as k-NN, Naive Bayes, SVM, Decision Forests and Neural Networks. Experience with commonly used data science toolkits, such as Python, SAS, R, Weka, NumPy or MatLab. Experience working with data visualization tools, such as D3.js and GGplot. Proficient skills using query languages, such as MongoDB, Cassandra and HBase. Strong applied statistics skills. High intellectual curiosity with the desire to identify potential use cases for predictive analytics. Experience creating impactful models and algorithms for multiple functional areas (e.g., risk management, customer insights, real-time decision support, etc.). Expert understanding of industry trends for consumer insights analytics. Ability to understand and apply trends in research and analytics, and to apply learning, insights and recommendations to drive critical objectives."
140,Director,Full-time,"Intelletec has teamed up with a tech firm on a mission to solve the biggest, most intractable challenges of enterprise software. They envision the rise of the Self-Driving Enterprise: a more autonomously functioning business with a central operating system that connects and orchestrates business operations. Due to rapid growth, they are looking to hire a Director of Data Science to grow their operation across the US and build out a world class data science team The Company Backed by some of the world’s best investors with $94 million for growth and research At the forefront of cognitive automation, transforming the way we work using Artificial Intelligence Deliver the technology that enables the Self-Driving Enterprise: a cognitive operating system that connects you with your business and autonomously orchestrates your operations Serves the Global 1000 from 8 offices, and is headquartered in Mountain View, California The role Base out of global headquareters in Mountain View, California or San Francisco offices Reports into the Co-founder / CTO of the organization Leading a Data Science function with high visibility and strategic impact Take on and lead large cutting edge data science projects, from inception to completion being somewhat hands-on Collaborate with other team members to build data-science products and services You will be working on new and challenging data science applications, using Machine Learning to solve complex business problems  What you need to succeed: Excellent leadership and communication skills, comfortable articulating technical terminoly in layman terms to key stakeholders, clients and influencers Leading a Data Science function and having experience of managing global teams  10-15 years of professional experience as a Machine Learning Engineer/Data Scientist; preferably in a product development setting Master’s or PhD Degree in Computer Science, Mathematics, Statistics or a related quantitative field with a focus on Machine Learning or Deep Learning. Ph.D. preferred Good intuitive understanding of machine learning algorithms and practical experience building models with incremental/iterative approach Hands-on experience with machine learning toolkits such as scikit-learn and TensorFlow Hands-on experience with software development, including translating ML models into scalable production services Experience working with cloud platforms such as AWS, and Google Cloud Platform and distributed computing technologies such as Apache Spark  If you share a passion for building the next generation of enterprise software and implementing it for the most sophisticated customers in the world, you’ve met your match.  Market leading package available."
141,Director,Full-time,"Head of Data ScienceNew York, New York$240,000 - $260,000 base salary + equity + benefits Harnham are partnered exclusively with one of the most successful asset management businesses globally. The company is looking for a data science leader for their digital innovation arm. Reporting into a Managing Director, this position has a high-level of visibility and calls for a proven leader with a strong technical background.   THE ROLE As the Head of Data Science, you will be required to: Collaborate closely with C-Level management to help make business critical decisions Work closely with peers to prioritize and create short / long term goals Use Machine Learning expertise to develop cutting edge models Be fully involved with the whole project life cycle, from prototyping to implementation Provide deep knowledge and leadership in machine learning, statistical analysis and varied data sets Write production code and communicate with the entire technical team to impact algorithm production Recruit and build a leading Data Science team  YOUR QUALIFICATIONS PhD in a quantitative field (STEM, Economics, etc.) Strong experience developing and implementing machine learning algorithms in a non-academic setting Experienced in statistical modeling, Bayesian modeling or other statistical methodologies Proven leader having built data science teams previously, ideally from a technology or consulting background Thorough communicator with technical team, clients and C level management  THE BENEFITSA competitive base salary of $240,000-$260,000 + bonus + benefits.HOW TO APPLYPlease register your interest by sending your résumé to Tim Jonas via the Apply link on this page.KEYWORDSMachine Learning | Technology | Statistics | SQL | Hadoop | Data Science | Analytics | Big Data | Python"
142,Not Applicable,Full-time,"Job DescriptionGallagher is a global leader in insurance, risk management and consulting services. We help businesses grow, communities thrive and people prosper. We live a culture defined by The Gallagher Way, our set of shared values and guiding tenets. A culture driven by our people, over 30,000 strong, serving our clients with customized solutions that will protect them and fuel their futures.Position SummaryTasked with leveraging company and external data to develop predictive models and other insights that provide business leaders with suggestions for revenue and process optimization, role incumbent(s) will define business problems and identify the data needed to solve problems.Key Responsibilities Include Independently developing predictive models, leveraging internal and external data, to optimize sales performance, customer experience, and marketing spend  Building models in Azure, and working with the team to ensure any business-accepted models can be moved into production  Coordinating with business analysts and data engineers to gather data for analysis  Leading testing of data quality and completeness for modeling attributes.  Produces written reports and recommendations for internal consumption, including problem statement, methods, interpretation of findings, and business implications.  Provides ad-hoc support to internal clients for data mining and other analytics. RequiredJob Qualifications Degree in quantitative field, such as data science, statistics, mathematics, computer science, finance, or economics.  3 years of experience using statistical modeling and/or machine learning techniques to build models that influence company decision-making.  Proficient with building data pipelines from larger data sets.  Excellent problem solving skills as well as critical thinking and conceptual thinking abilities.  Intermediate to advanced proficiency in SQL and R or Python.  Experience with cloud tools and structures, preferably Azure.  Experience with distributed data and computing tools: MapReduce, Hadoop, Hive, Spark, MySQL, etc. Preferred Continued interest in further building mathematical and programming skills.  A background in insurance, insurance brokerage, or financial services desirable.  Pursuit of a Master’s or PhD in quantitative field, such as data science, statistics, mathematics, computer science, finance, or economics. Work Traits Good communication skills to provide highly technical, analytical assessments to team leaders. U.S. Eligibility Requirements Interested candidates must submit an application and resume/CV online to be considered  Must be 18 years of age or older  Must be willing to submit to a background investigation; any offer of employment is conditioned upon the successful completion of a background investigation  Must have unrestricted work authorization to work in the United States. For U.S. employment opportunities, Gallagher hires U.S. citizens, permanent residents, asylees, refugees, and temporary residents. Temporary residence does not include those with non-immigrant work authorization (F, J, H or L visas), such as students in practical training status. Exceptions to these requirements will be determined based on shortage of qualified candidates with a particular skill. Gallagher will require proof of work authorization  Must be willing to execute Gallagher’s Employee Agreement or Confidentiality and Non-Disclosure Agreement which requires, among other things, post-employment obligations relating to non-solicitation, confidentiality and non-disclosure Gallagher offers competitive salaries and benefits, including: medical/dental/vision plans, life and accident insurance, 401(K), employee stock purchase plan, educational expense reimbursement, employee assistance program, flexible work hours (availability varies by office and job function) training programs, matching gift program, and more.Gallagher believes that all persons are entitled to equal employment opportunity and does not discriminate against nor favor any applicant because of race, sex, color, disability, national origin, religion, creed, age, marital status, citizenship, veteran status, gender, gender identity / expression, actual or perceived sexual orientation, or any other protected characteristic. Equal employment opportunity will be extended in all aspects of the employer-employee relationship, including, but not limited to, recruitment, hiring, training, promotion, transfer, demotion, compensation, benefits, layoff, and termination. In addition, Gallagher will make reasonable accommodations to known physical or mental limitations of an otherwise qualified applicant with a disability, unless the accommodation would impose an undue hardship on the operation of our business.JobFinancePrimary LocationUnited States-Illinois-Rolling MeadowsOrganizationGB US OperationsScheduleFull-timeTravelNo"
143,Mid-Senior level,Full-time,"11 West 19th Street (22008), United States of America, New York, New YorkAt Capital One, we’re building a leading information-based technology company. Still founder-led by Chairman and Chief Executive Officer Richard Fairbank, Capital One is on a mission to help our customers succeed by bringing ingenuity, simplicity, and humanity to banking. We measure our efforts by the success our customers enjoy and the advocacy they exhibit. We are succeeding because they are succeeding.Guided by our shared values, we thrive in an environment where collaboration and openness are valued. We believe that innovation is powered by perspective and that teamwork and respect for each other lead to superior results. We elevate each other and obsess about doing the right thing. Our associates serve with humility and a deep respect for their responsibility in helping our customers achieve their goals and realize their dreams. Together, we are on a quest to change banking for good.Data Science ManagerAt Capital One, data is at the center of everything we do. When we launched as a startup we disrupted the credit card industry by individually personalizing every credit card offer using statistical modeling and the relational database, cutting edge technology in 1988! Fast-forward a few years, and this little innovation and our passion for data has skyrocketed us to a Fortune 200 company and a leader in the world of data-driven decision-making. Twenty-five years after Capital One was started it’s still led by its founder. Be ready to join a community of the smartest people you’ve ever met, who see the customer first, and want to use their data skills to make a difference.As a Data Science Manager at Capital One, you’ll be part of a team that’s leading the next wave of disruption at a whole new scale, using the latest in distributed computing technologies and operating across billions and billions of customer transactions to unlock the big opportunities that help everyday people save money, time and agony in their financial lives.On Any Given Day You’ll BeUsing Big Data tools (Hadoop, Spark, H2O, AWS) to conduct the analysis of billions of customer transaction recordsWriting software to clean and investigate large, messy data sets of numerical and textual dataIntegrating with external data sources and APIs to discover interesting trendsBuilding machine learning models from development through testing and validation to our 30+ million customers in productionDesigning rich data visualizations to communicate complex ideas to customers or company leadersInvestigating the impact of new technologies on the future of digital banking and the financial world of tomorrowThe Ideal Candidate Will BeCurious. You ask why, you explore, you're not afraid to blurt out your disruptive idea. You probably know Python, Scala, or R and you’re constantly exploring new open source tools.Wrangler. You know how to programmatically extract data from a database and an API, bring it through a transformation or two, and model it into human-readable form (ROC curve, map, d3 visualization, Tableau, etc.).Creative. Big, undefined problems and petabytes of data don't frighten you. You’re used to working with abstract data, and you love discovering new narratives in unmined territories.Basic QualificationsBachelor’s Degree plus 6 years of experience in data analytics, or Master’s Degree plus 4 years of experience in data analytics, or PhD plus 2 years of experience in data analyticsAt least 3 years’ experience in open source programming languages for large scale data analysisAt least 3 years’ experience with machine learningAt least 3 years’ experience with relational databasesAt least 1 years’ experience managing high-functioning data science/data engineering teamsPreferred QualificationsPhD in “STEM” field (Science, Technology, Engineering, or Mathematics) plus 2 years of experience in data analyticsAt least 1 year experience working with AWSAt least 1 year experience managing peopleAt least 5 years’ experience in Python, Scala, or R for large scale data analysisAt least 5 years’ experience with machine learningAt least 5 years’ experience with SQLCapital One will consider sponsoring a new qualified applicant for employment authorization for this position.Job Category - Strategy, Sponsored, Data Science, Company Builders, Product Innovators"
