,Level,Type_of_Job,Description
187,Internship,Internship,"What variables are meaningful for studying the performance of our personalization algorithms? What is the role of Travoom.com’s social integration for helping users find content? What does a user’s visit behavior tell us about their engagement? The data scientist will be responsible for designing, developing and maintaining systems involving various techniques such as Artificial Intelligence, Machine Learning, Large Scale Data Mining, Network Analysis, Information Retrieval, and Probabilistic Modeling. These skills are required for finding anomalies in large data sets, Pattern Recognition, Language Processing and Mining structured, semi-structured and unstructured data. Each travoom user will have a personalized feed exacltylike Pinterest, daily emails exclusive to each user, what is the data we are collecting to personalize each user experience even when we hit 200MM users.Candidates initial role will be identifying viral loops and growth opportunities. Facebook, Instgarma and Pinterest integration, inviting friends, follow-up emails, identifying holes in the existing process. Identifying every possible growth opportunity the company has.If you are interested in solving such problems, and then defining some more of your own and solving them, and have the tech/analytical skills to back it up, let’s talk!Responsibilities VIRAL GROWTH Leverage data mining and machine learning approaches to model and predict end user behavior. Mine and analyze data, applying statistical methods as necessary, pertaining to customers’ discovery and viewing experiences to identify critical product insights. Proactively develop new metrics and studies to quantify the value of different aspects of product personalization, and set up ongoing reports to continually measure their performance. Translate analytic insights into concrete, actionable recommendations for business or product improvement. Drive efforts to enable product and engineering leaders to share your knowledge and insights through clear and concise communication, education, and data visualization.QualificationsRuthless passion for winning.CODING a huge PLUS Proficiency at querying relational databases (SQL) and experience independently working with and exploring data Great with numbers, tables, charts, trends – everything data. Strong skills in at least one of the following analytic tools: R, SAS, SPSS, Excel Good understanding of high-level product architecture and data flow patterns. Strong interpersonal and communication skills: ability to tell a clear, concise, actionable story with data, to people across various levels of the company. Pursuing BS or MS degree in Mathematics, Computer Science, Statistics, Operations Research, or other quantitative field.Additional Information Creative problem solver who can courageously propose and support new ideas to bring travel and adventure to more people worldwide.  Ability to adapt. An ideal candidate will welcome the opportunity to solve a broad range of problems using a wide array of technologies.  Comfortable with ambiguity, shifting priorities and general growth pains of an early-stage technology company  Exceptional entrepreneurial judgment that fosters independence over micro-management  Strong work ethic and ability to deliver high-quality results in a fast-paced work environment  Detail oriented and organized with superior analytical abilities  Excellent communication, presentation and interpersonal skills  Compensation will be a package of Salary, Bonus and Equity depending upon experience and quantifiable contributions to profitability  Part time help during fundraisingTravoom.com is located in beautiful Santa Monica, we are privately held and rapidly growing!"
188,Entry level,Full-time,"Requirements 2 years of experience in quantitative analysis or data science Strong problem-solving skills, with experience breaking down a large problem into smaller, solvable components Strong skills in SAS SQL. Strong skills in data exploration, analysis, and visualization with Python or R. Strong understanding of methods in statistical analysis (e.g., supervised machine learning methods, hypothesis testing, etc.) Experience with BI and data visualization tools like R, Shiny. Ability to initiate and drive projects to completion Experience with Decision Support Models. Excellent written and verbal communication skills with the ability to communicate the results of your work in meaningful ways Strong collaboration skills with both technical and non-technical groups"
189,Entry level,Full-time,"Requirements 2 years of experience in quantitative analysis or data science Strong problem-solving skills, with experience breaking down a large problem into smaller, solvable components Strong skills in SAS SQL. Strong skills in data exploration, analysis, and visualization with Python or R. Strong understanding of methods in statistical analysis (e.g., supervised machine learning methods, hypothesis testing, etc.) Experience with BI and data visualization tools like R, Shiny. Ability to initiate and drive projects to completion Experience with Decision Support Models. Excellent written and verbal communication skills with the ability to communicate the results of your work in meaningful ways Strong collaboration skills with both technical and non-technical groups"
190,Associate,Full-time,"Job DescriptionWe are expanding its technology and quant team to build disruptive new products to further revolutionize trading and investing. Our products are used by the largest investment firms globally, and we are recognised as an industry-leading innovator in big data analytics, AI and machine learning.We are a dynamic, technology-driven, and highly productive team of quants, developers and product designers. Deep collaboration with our clients and partners is key, and we benefit from great relationships with the most ground-breaking firms in the asset management industry, who help us to constantly push the limits of technology and analytics.We have a track record of hiring amazing people and giving them (industry veterans and recent grads alike) autonomy and responsibility from the start. You'll have the best tools and resources available to get the job done, and thrive in a collaborative environment where our teams are passionate about building great things.The right candidates will have both a strong mathematical background, and be highly adept technologically.Responsibilities Analyse unique proprietary data sets. Create, evaluate, and enhance mathematical models and streaming analytics pipelines. Write production code. Partner globally with other data scientists, quants, developers, product designers, clients and industry leaders to tackle the important problems faced by the world's largest asset managers.  SKILLS Bachelor's degree in Computer Science, Mathematics or related technical focus. 2&plus; years of relevant experience OR recent Master's or PhD grad in Computer Science, Mathematics or related field. Proficiency in a mainstream programming language, such as Python, C/C&plus;&plus;, C#, Java, JavaScript, Haskell or similar. A strong foundation in a STEM/numeric discipline. Familiarity with software development practices such as version control (git), test frameworks, code review tools, deployment configuration management, continuous integration. Experience with machine learning libraries/frameworks and methods Excellent communication skills and team orientation"
191,Internship,Internship,"Job DescriptionIn this role, you will be working in an interdisciplinary environment and will obtain invaluable transferable skills. Moreover, you will have a chance to highly impact the company success. Being aware of various sources of biases in the data and critical thinking skills are essential for interpreting data. We also want to see a passion for machine-learning and research. At least 6 month commitment is preferred.Responsibilities Automate data collection processes Undertake preprocessing of structured and unstructured data Report potential biases in the original source and the preprocessing approach Present information using data visualization techniques Collaborate with machine learning, experimental discovery, and clinical development teams."
192,Entry level,Full-time,"Machine learning data science Work Location Reporting Address Sunnyvale, CA 94085 Client Name Apple Inc Vendor Rate 65.00 Contract duration 3 Months Must Have Skills Data Science Machine learning Python Detailed Job Description Data Scientist with Machine learning and Deep learning skills. Experience in Python and R language. Minimum years of experience 5+ Certifications Needed No Top 3 responsibilities you would expect the Subcon to shoulder and execute Data Analysis Machine learning tools dev Client interfacing"
193,Associate,Full-time,"Job DescriptionØptimus Consulting, a data science and software company, is seeking a data science fellow in the Washington, DC area. Fellows with the Data Science & Predictive Analytics team will participate in all aspects of work at Øptimus. In an environment where ""long-term"" projects last one or two weeks, no two days are the same. You'll work on multiple projects: writing call scripts that are used in hundreds of thousands of calls, streamlining our current workflow, sitting in on meetings to offer your valuable insight, and creating statistical models to meet the needs of our clients, just to name a few. We'll match what you're good at with what you enjoy and what we need.Fellowships are intended for recent college graduates or those with graduate degrees looking to transition into data science. The fellowship is a twelve-month full-time position with an opportunity for a permanent job offer upon completion.Qualifications Must have a college degree in a STEM or social science field, or equivalent real-world experience. At least one course in statistics is required. Having courses or experience in machine learning, data mining, regression, generalized linear models, experimental design, and/or GIS is especially desired. A Masters or Doctorate Degree is a plus but not necessary. Must be able to learn quickly and juggle multiple projects with moving deadlines. Must have strong analytical skills. Must have killer Excel skills and be incredibly competent in Word and PowerPoint. Must have experience in R or Python. Experience with Tableau is a plus. A passion or knowledge for politics is preferred but not necessary. Experience with political campaigns, commercial operations, or similar efforts can be very helpful. Experience with computer programming is a plus. CompensationFellows with Øptimus are salaried W2 employees and have benefits, including health insurance, dental and vision insurance, transportation reimbursement, and cell phone reimbursement.CompanyØptimus Consulting is a family of statisticians, graphic designers, data scientists, programmers, social media marketing analysts, and recovering politicos. Since its founding in 2013, 0ptimus has been at the forefront of developing innovative data and analytics software platforms. 0ptimus has designed and delivered data-driven strategies for leading political campaigns, Fortune 500 companies, and non-profits around the globe.We handle a wide variety of projects and use many different technologies and programs to meet our clients' needs, so our culture here is one of constant learning and curiosity, while doing things the right way. We boast a two-floor office near the yellow and blue Metro lines, no cubicles, a nacho cheese machine, and kegerator. If you live by the ""work hard, play hard"" philosophy, then you'll be a great fit with the Øptimus team.vumS6HpHpp"
194,Mid-Senior level,Full-time,"Why VacasaWe started with just one home and an idea: to bring homeowners and renters together with smart technology and caring local teams. Today, we’re the largest full-service vacation rental company in the US. Today, we’re one of the fastest-growing vacation rental companies in the world—thanks to the people who give us their best every day. You’ll fit right in here if you’re curious, entrepreneurial, and thrive in a rapid-growth environment.What We’re Looking ForWe are seeking a leader who is passionate about building a world class Data Science team in order to achieve Vacasa’s goal of providing a fantastic home base for any vacation. In addition to solving problems and removing roadblocks for your team, you’ll help define the vision, tools, and processes that help us take on challenges like: Determining the potential rental value of any vacation rental home, and how to increase that potential Pricing each of our unique units in real time given global market conditions to ensure we have homes available for potential guests while maximizing owner revenue Optimally scheduling home cleaning while giving our employees scheduling certainty Matching each guest’s expectations with a tailored experience  What You’ll Do Manage and guide the careers of our growing Data Science team Represent their work to the executive team and the rest of the organization Guide the team’s research, discovery, and implementation Stay curious about the field of Data Science, operate with empathy towards others, drive innovation, and remain accountable to yourself & team Keep your tech skills (Python, R, Stata, Big Data, etc.) sharp by contributing to our code Skills You’ll Need Experience managing folks working on data science projects Inquisitivity about statistics, systems engineering, algorithms, economics, operations research and related fields Advanced proficiency with Git/GitHub, Python, SQL, cloud computing, and machine learning Bonus Points Stellar listening and communication skills A Master’s or PhD with coursework focused on building data models You have intriguing stories to tell about your work applying the right statistical techniques to the right circumstances, have lead folks in applying those techniques for a multitude of situations, and the prospect of more work in this arena genuinely excites you What You’ll Get Health/dental/vision insurance—100% coverage option 401K retirement savings plan with up to a 6% company match Vacation time Paid sick leave and holidays Career advancement opportunities Employee discounts All the equipment you’ll need to be successful Great colleagues and culture"
195,Mid-Senior level,Full-time,"Shipt is a membership-based marketplace that helps people get the things they need. Our friendly shoppers handpick fresh groceries and household essentials and deliver them to members in as soon as one hour.What Does Data Science Do at Shipt?At Shipt, we work at the intersection of a multi-sided marketplace and we’re looking for help understanding data collected across this complex marketplace, optimizing existing processes, and making predictions to help improve the product and experience.Our team tackles a wide variety of projects, ranging from developing sophisticated predictive and machine learning models, conducting ad-hoc research, working with engineers on service development and deployments, and presenting results to functional teams. Our ideal candidate will be data-driven, intellectually curious, and a clear communicator.Your Days Will Look Like… leading and developing a highly skilled team of data scientists and analysts … providing technical guidance and implementation details for the team as they work through projects big and small… collaborating with partners across product, engineering, and operations to accomplish business goals… leading and prioritizing exploratory work to uncover new opportunities… working with leaders to build data-informed strategies and roadmapsYou may be a fit for this role if you:… are a strong data scientist with 4+ years of experience… have 1+ years managing data scientists or 1+ years as a Tech Lead… have expertise solving complex and highly impactful quantitative problems with at least one scripting language (Python or R - we use both) and SQL… enjoy mentoring data scientists through their projects and careers… don’t mind getting hands on with challenging technical problems across a broad spectrum of data science problems, encompassing NLP, search, operations research, and semi-supervised learning problemsYou'll Get Bonus Points For... experience with batch and streaming data frameworks... work around on-demand or multi-sided marketplace problemsHere are some projects that the team is actively working on:Improving search rankings and relevancy through engagement metrics, inferred popularity, named entity recognition, and a number of other techniquesImproved order offering and the logistical component of deliveries through order batchingNLP on free text to pull out specific product information and product matchesWe are an equal opportunity employer and value diversity at our company. We do not discriminate on the basis of race, religion, color, national origin, gender, sexual orientation, age, marital status, veteran status, or disability status.Pursuant to the San Francisco Fair Chance Ordinance, we will consider for employment qualified applicants with arrest and conviction records."
196,Entry level,Full-time,"Qualifications Minimum of MS, Phd Strongly Preffered, in Statistics, or related quantitive discipline Minimum 5 years of experience with phd and 8 Years of experience with MS in relevant areas of Data Science and proven capability in applying Accomplished academic background in health data applications hard evidence of extensive biomedical collaborations and publication record preferred Strong analytical and problem-solving Skills Strong technical Skills Experience in R, python, SQL, Spark, Cloud Services (Azure, AWS) Excellent writing, Communication and Presentation Skills, proficiency in data interpretation, delivering messages with impact to internal and external customers. Intellectual curiosity and agility Ability to work independently as well as collaboratively within a team setting"
197,Entry level,Full-time,"As Ribbon's Data Science Lead, you'll create best practices and grow the data culture. You'll work closely with the leaders across every department to create more teams which are run by data driven insights. You'll have the opportunity to grow and manage the DS function and team.Your Focus Becoming a subject matter expert in sales operations, structured finance and real estate operations. Understand the systems, understand the users, and drive towards identifying core opportunities for the business. Work directly with directors of finance, marketing and sales to create more data driven functions across the business. Prepare technical reports, reviews and analysis of current processes. Participate in backlog grooming, sprint planning, and retrospectives. Responsible for translating high-level business requirements into detailed functional specifications and managing the requests for changes. Establish data driven practices for understanding high level business metrics like CAC and LTV.Your Skills Strong organizational skills, including the ability to successfully manage multiple priorities and projects and consistently meet deadlines in a fast-paced environment. Experience with cloud platforms, ideally AWS. Familiarity with SQL and noSQL datastores like Redshift, Postgres, Elasticsearch and MongoDB. Experience with SQL or other data visualization tools (like R or Python). You have a track record building or scaling data driven organizations."
198,Not Applicable,Full-time,"Minimum Qualifications Bachelor's degree in a quantitative discipline or equivalent practical experience. 4 years of relevant work experience involving quantitative data analysis Experience with statistical software (e.g., R, Python) and database languages (e.g., SQL). Preferred Qualifications Master's degree or higher in a quantitative discipline (e.g., Statistics, Computer Science, Math, Engineering) or equivalent practical experience Strong knowledge and hands-on experience with both supervised and unsupervised learning (e.g. time series forecasting, clustering, classificaiton) and/or Big Data techniques (Spark, Pig, Hive) is a big plus. Demonstrable track record of dealing well with ambiguity, prioritizing needs, and delivering results in a dynamic environment Effective communication (written and verbal) to translate technical solutions and methodologies to senior leadership About The JobAt Google, data drives all of our decision making. The Finance Business Intelligence and Analytics team combines business acumen, technology and innovation to organize data, enable insights and create a data driven and efficient Finance organization. You will have a unique opportunity to gain perspectives on Google’s core businesses, services and the ecosystems that they operate within.As a Data Science Specialist, you will work on strategic business challenges across multiple business areas (ex. Ads, YouTube, Search, Play, etc.) through the lens of monetization. You will collaborate with data engineers, analysts and PMs to create an end-to-end data solutions to enable our finance partners to make informed decisions, manage risks and opportunities. You will demonstrate statistical and machine learning experience and an understanding of our business models to tackle complex data problems.The name Google came from ""googol,"" a mathematical term for the number 1 followed by 100 zeros. And nobody at Google loves big numbers like the Finance team when providing in depth analysis on all manner of strategic decisions across Google products. From developing forward-thinking analysis to generating management reports to scaling our automated financial processes, the Finance organization is an important partner and advisor to the business.Responsibilities Partner with Finance leadership and their teams to understand business context and identify science solutions. Apply statistical and machine learning methods to solve large scale problems, including the full modeling lifecycle (e.g. data manipulation, building and evaluating models, interpreting results, transitioning solutions to production, performance monitoring, recalibrating models, etc.) Create data visualization to summarize the modeling insights and communicate them to internal team members and business stakeholders Continue to widen and deepen data science and engineering skill sets Coach junior members and share knowledge with the broader team At Google, we don’t just accept difference—we celebrate it, we support it, and we thrive on it for the benefit of our employees, our products and our community. Google is proud to be an equal opportunity workplace and is an affirmative action employer. We are committed to equal employment opportunity regardless of race, color, ancestry, religion, sex, national origin, sexual orientation, age, citizenship, marital status, disability, gender identity or Veteran status. We also consider qualified applicants regardless of criminal histories, consistent with legal requirements. See also Google's EEO Policy and EEO is the Law. If you have a disability or special need that requires accommodation, please let us know by completing this form ."
